{"draws":[{"erase":{"color":16777215,"kind":"opaque_fill","rects":[[72.0,86.4280014038086,371.3380126953125,104.43299865722656]]},"lines":[{"origin":[72.0,96.1780014038086],"text":"丈不丕与丈丂丄 2026-0001 · 丁丄不丂万丌一丑上 丅丈丗专且丑丄"},{"origin":[72.0,107.3905014038086],"text":"丏一丆丄 1 与丅 8"}],"size":9.75,"text_color":0},{"erase":{"color":16777215,"kind":"opaque_fill","rects":[[72.0,118.17500305175781,370.3309631347656,133.28900146484375]]},"lines":[{"origin":[72.0,129.1750030517578],"text":"一…·"}],"size":11.0,"text_color":0},{"erase":{"color":16777215,"kind":"opaque_fill","rects":[[72.0,148.1750030517578,321.0510559082031,163.28900146484375]]},"lines":[{"origin":[72.0,156.4250030517578],"text":"下丈不丄 丈专丄丌 1: 丏丑与丅丄丒丒丈与不一下 七与丂且丌丄不专"},{"origin":[72.0,165.91250305175782],"text":"专丑一不丒下一专丈与不 丒丄丑丕丈丂丄丒"}],"size":8.25,"text_color":0},{"erase":{"color":16777215,"kind":"opaque_fill","rects":[[72.0,178.1750030517578,325.7370300292969,193.3769989013672]]},"lines":[{"origin":[72.0,186.4250030517578],"text":"一丌与且不专 七且丄: 丄且丑 125.00 · 丏一丘一丁下丄 世丈专万丈不"},{"origin":[72.0,195.91250305175782],"text":"30 七一丘丒"}],"size":8.25,"text_color":0}],"execution":{"assemble":true,"erase_order":"interleaved","subset_fonts":true},"render":{"alpha":false,"clip":[72.0,118.17500305175781,370.3309631347656,133.28900146484375],"kind":"clip","matrix":[4.0,4.0]},"schema_version":1,"source_page":{"crop_box":[0.0,0.0,595.0,842.0],"media_box":[0.0,0.0,595.0,842.0],"page_number":1,"rotation":0,"sha256":"8007b9772e75998af9652afa04ec9bcbfba07ba8763610a5009da7d8cc572533"}}